{
  "id": "response-nestle-cereulide-notification-timeline-2026",
  "entity_id": "nestle",
  "related_claim_ids": [
    "claim-nestle-infant-formula-notification-timeline-dispute-2026"
  ],
  "published_at": "2026-01-29",
  "source_id": "source-nestle-infant-formula-timeline-2026",
  "summary": "Nestlé publie sa propre chronologie : l'entreprise affirme avoir détecté de faibles niveaux de céréulide sur une ligne de production à la fin novembre 2025, bloqué la production, confirmé les résultats début décembre, puis informé les autorités des Pays-Bas, des pays potentiellement concernés et de la Commission européenne le 10 décembre 2025. Elle indique avoir lancé le même jour un rappel volontaire de 25 lots dans 16 pays. Cette chronologie est la version de l'entreprise et doit être lue avec l'enquête journalistique qui la conteste.",
  "full_response_url": "https://www.nestle.com/sites/default/files/2026-01/rappel-laits-infantiles-explication-faits-chronologiques.pdf",
  "publication_status": "published"
}
